Funder name,Name of the call or program and URL,Deadline,Eligibility,Keywords
[USA - National Science Foundation (NSF)](https://www.nsf.gov/), [Strengthening the Cyberinfrastructure Professionals Ecosystem (23-521)](https://beta.nsf.gov/funding/opportunities/strengthening-cyberinfrastructure-professionals),2023/02/23,"Aims to democratise access to NSF’s advanced cyberinfrastructure ecosystem; ensure fair and equitable access to resources, services, and expertise by strengthening how Cyberinfrastructure Professionals function in this ecosystem", "Principal investigators (PIs), NFS"
[Germany - DFG](https://www.dfg.de/en), [Increase the Usability of Existing Research Software](https://www.dfg.de/foerderung/info_wissenschaft/info_wissenschaft_22_85/index.html), 2023/01/10, "This interdisciplinary call for proposals pursues three sub-goals which together seek to raise the maturity level of research software so that it can also be used by researchers other than those developing it, and to simplify its further development: usability and impact, quality assurance, and further development", "Germany, sustainability, quality, development"
[USA - Department Of Energy Office of Science](https://science.osti.gov/), [Seed Collaborations for Software Sustainability (DE-FOA-0002844)](https://science.osti.gov/ascr/-/media/grants/pdf/foas/2023/SC_FOA_0002844.pdf), 2022/12/19, "The Advanced Scientific Computing Research (ASCR) program seeks to support software sustainability of the ecosystem of software for scientific and high-performance computing and should describe how their efforts might be rapidly scaled up in the future", "USA, HPC, sustainability,"
CHIST-ERA,[Open & Re-usable Research Data & Software](https://www.chistera.eu/call-ord-announcement),2022/12/14,"Open call where the project consortia must have a minimum of 3 partners from at least 3 of the following countries: Belgium, Brazil, Czech Republic, France, Lithuania, Luxembourg, Poland, Slovakia, Switzerland, Turkey, United Kingdom. This call addresses any research domain",open software
[Japan Science and Technology Agency (JST)](https://www.jst.go.jp/inter/english/index.html),[Advanced International Collaborative Research Program (AdCORP)](https://www.jst.go.jp/inter/english/program_e/announce_e/announce_adcorp_2022.html),2022/11/30," ""Field 6. Quantum. Research area: Research related to quantum computers and quantum software which contributes to the realization of a productivity revolution. The Japanese-side researchers must be affiliated with a university  research institution  or company in Japan.  The foreign research partners should be based in Canada,  France, Germany, The UK or Japan the UK or the USA."""," ""Japan,  Applied sciences,  Computer science,  Natural sciences"""
[IEEE Computer Society](https://www.computer.org/),[Diversity & Inclusion Fund](https://www.computer.org/about/diversity-inclusion/project-proposals),2022/11/14,"Looking for new types of projects/activities/events not already covered by the Computer Society to impact diversity, equity, and inclusion","D&I, DEI, Diversity, Equity and Inclusion"
